country,Date,Until,Headline,Description,Sources,MostPeaceful2023GPI
PH,2010.0,,More than 30 armed men detonate an improvised explosive device at the electric transformer of a Pump House,"At night in Victorias City, Negros Occidental, Philippines, more than 30 armed men detonate an improvised explosive device at the electric transformer of Malago Pump House owned by the Victorias Milling Company sugar refinery before setting it on fire. The damage is initially placed at  P400,000 ($9,246 USD). No casualties are reported. New People?s Army militants claim responsibility.",National Consortium for the Study of Terrorism and Responses to Terrorism (START) 2018. ID. 201010050009,2.229
PH,2009.0,,Homemade bomb is planted inside the gates of the Metro Water District,"On Wednesday, ordnance experts defuse a homemade bomb discovered by employees  planted on a bench inside the gates of the Metro Water District, a government-run building at Cotabato, Philippines. No damage or casualties occur. No group claims of responsibility for the attack.",National Consortium for the Study of Terrorism and Responses to Terrorism (START) 2018. ID. 200904290018,2.229
PH,2003.0,,Main water pipeline is destroyed by grenades in the Philippines,"Two grenades destroy a water pipeline at a reservoir in Kidapawan, Philippines, disrupting water supply to approximately 100,000 residents. The Moro Islamic Liberation Front is accused of the attack.",National Consortium for the Study of Terrorism and Responses to Terrorism (START) 2018. ID. 200303190005,2.229
PH,2001.0,,Philippine water poisoned,"The militant Islamist separatist group Abu Sayyaf threatens to poison the water supply in Isabela, a mainly Christian town on Basilan Island in the country's south. In October, residents in six nearby villages are suspected for contamination due to water that smelled like gasoline. Local officials respond by closing pipelines and bringing in drinking water by truck. In the months following the 9/11 attacks on New York, numerous false alarms of terrorist activity are reported around the world.",World Environment News 2001,2.229
XK,2015.0,,Kosovo authorities shut off water to Pristina as preventative measure against a planned attack,"A planned attack on the water supply in Pristina, Kosovo is prevented before its execution. The attack is intended to contaminate Badovac Lake, the largest water reservoir uphill of the city. As a preventative measure, Kosovo authorities temporarily shut off the water supply to tens of thousands of people in the capital after police arrest five suspects linked to Islamic State.","Guardian, The 2015",
XK,2004.0,,Security staff of a public water system shot at while working,"Bullets are fired at the security staff of a public water pumping station in Kosovska Mitrovica, Kosovo. Authorities blame Albanian extremists for the attack.",RAND Database of Worldwide Terrorism Incidents 2018,
XK,1999.0,,Serbs cut off water to Pristina,Serbian engineers shut down water system in Pristina prior to occupation by NATO.,Reuters 1999b,
CA,2015.0,,Explosive devices discovered near water treatment plant in Canada,"Two small explosive devices are discovered near a water treatment plant in Barrie, Canada. No one is injured and no suspects are identified in a report on the incident.",Davidson 2015,1.35
CA,2013.0,,Elsipotog Nation protests over fracking impact to water resources in Canada,Several injuries are reported and six police cars burned during a protest by members of the Elsipogtog First Nation in Canada over the impacts to local water resources from fracking operations.,CTV News 2013,1.35
CA,2007.0,,Tampering in Toronto,"A Toronto man previously accused of attempted murder and illegal possession of explosives is charged with eight more counts of attempted murder after allegedly tampering with bottled water, which he injected with an unspecified liquid.",Toronto Star 2007,1.35
CA,1991.0,,British Columbia water supply threatened,"A threat is made via an anonymous letter to contaminate the water supply of the city of Kelowna, British Columbia, with ""biological contaminates."" The motive is apparently ""associated with the Gulf War."" The security of the water supply is increased in response and no group is identified as the perpetrator.",Purver 1995,1.35
CF,2014.0,,Christian militias reportedly kill Muslim civilians,Continued sectarian violence in the Central African Republic between Muslim and Christian militias includes reports of Muslim civilians being killed and their bodies thrown down water wells.,Lodge 2014,2.934
IL,2006.0,,"Lebanon, Israel target water infrastructure in attacks","Hezbollah rockets damage a wastewater plant in Israel. Israeli counter-attacks damage water systems throughout southern Lebanon, including tanks, pipes, pumping stations, and facilities along the Litani River.",Science 2006,2.706
IL,2001.0,,Palestinians destroy water supply to Israeli settlements,"Palestinians destroy water supply pipelines to the West Bank settlement of Yitzhar and to Kibbutz Kissufim. The Agbat Jabar refugee camp near Jericho disconnects from its water supply after Palestinians loot and damage local water pumps. Palestinians accuse Israel of destroying a water cistern, blocking water tanker deliveries, and attacking materials for a wastewater treatment project.",Israel Line 2001a,2.706
IL,2011.0,,Israeli settlers destroy wells in attack on West Bank village,"Israelis from nearby settlements attack Qasra, a West Bank village of 6,000, destroying crops and a water well. Attackers previously burned down a mosque and damaged hundreds of olive trees.",Bsharat and Ramadan 2011,2.706
IL,2011.0,,Israel destroys Palestinians' water pumps and wells,"Israel's military destroys nine water tanks in the Bedouin village of Amniyr in the South Hebron Hills, in the West Bank, Palestine. Later, soldiers destroy pumps and wells in the Jordan Valley villages of Al-Nasriyah, Al-Aqrabiyah, and Beit Hassan.",Aburawa 2011,2.706
IL,2006.0,,"Rocket attack damages a Mekorot water station, Israel","Palestinian Islamic Jihad (PIJ) claims responsibility for a rocket attack, which is aimed at Ashkelon, Israel, but lands in an industrial area just south of Ashkelon, damaging a Mekorot water station, causing no injuries.",National Consortium for the Study of Terrorism and Responses to Terrorism (START) 2018. ID. 200602030011,2.706
IL,2005.0,,Rocket lands near an Israeli national water company facility,"In one of two incidents in Israel on this day (cf. 200512120003), a Qassam rocket lands near a facility belonging to the Israeli national water company, Mekorot, in the western Negev desert. There are no injuries or damages resulting from the strike.",National Consortium for the Study of Terrorism and Responses to Terrorism (START) 2018. ID. 200512120004,2.706
IL,1998.0,,Water line attack leaves 11 communities without water,Eleven communities in the Negev area of Israel are left without water after a main water line is attacked by an unknown group.,RAND Database of Worldwide Terrorism Incidents 2018,2.706
ZM,2014.0,,Riots over erratic water supply in Kitwe,Kitwe's Wusakile and Chamboli townships experience riots over erratic water supply. Residents engage police in skirmishes and eight people are arrested.,Zambia Daily Mail 2014,1.898
ZM,1999.0,,Zambia water cut off,"Bomb blast destroyed the main water pipeline, cutting off water for the city of Lusaka, population 3 million.",Financial Times Global Water Report (FTGWR) 1999,1.898
ZM,1999.0,,Water pipeline in Zambia is bombed.,"A water pipeline is bombed along the Great North Road in Lusaka, Zambia. No group claims responsibility for the attack, however the National Union for the Total Independence of Angola is suspected of placing the bomb. This attack coincides with four other area bombings on the same day.",Agence France-Presse (AFP) 1999,1.898
ZM,1999.0,,"Bombs damage water, power, and Angolan Embassy in Lusaka","Sixteen bombs are reported to have exploded throughout the city of Lusaka, Zambia, with damage targeted at water pipes, power lines, and the Angolan Embassy. At least one person is killed and two are injured. Many people are without water and power for many days after the explosions. No one claims responsibility for the bombs, however, it is speculated that the attackers were seeking to discredit the Zambian government by causing chaos.",RAND Database of Worldwide Terrorism Incidents 2018,1.898
MK,2001.0,,Water cut off in Macedonian conflict,"Water flow to Kumanovo (population 100,000), Macedonia cut off for 12 days in conflict between ethnic Albanians and Macedonian forces. Valves of Glaznja and Lipkovo Lakes damaged.",Agence France-Presse (AFP) 2001,1.713
MK,2001.0,,Fight over control of a water supply reservoir,"Macedonians and native Albanians in the border village of Radusa fight to control the water reservoir that supplies water to Skopje, the nation's capital.",Fisher 2001,1.713
CN,2013.0,,Chinese dam builders killed after attack by Uyghurs,"Hundreds of Uyghurs are arrested following an attack on May 20th that led to the death of seven Han Chinese workers building a dam on the Karakash River in Hotan (in Chinese, Hetian) prefecture's Karakash (Moyu) county, China. Local officials ascribe the violence to land and water disputes and cultural differences between Han immigrants [to Xinjiang] and Uyghurs.",Hoshur 2013,2.009
CN,2012.0,,Chinese protestors challenge Japanese factory for discharging contaminated wastewater,"In July, thousands of protesters take to the streets in Qidong, Jiangsu Province to challenge a pipeline from a Japanese owned paper factory that would discharge contaminated wastewater into the sea, potentially pollute a nearby fishery, and contaminate drinking water. Demonstrators clash with police and there are reports of damages to government buildings, cars, and other property. Fourteen people plead guilty to encouraging the riot in which dozens of police are injured and the local Communist party chief is stripped half-naked.",Economy 2013,2.009
CN,2008.0,,China cracks down on Tibet,"China launches a political crackdown in Tibet. At least some observers have noted the importance of Tibet for the water resources of China, though the political complications between Tibet and China extend far beyond water. As noted: ""Tibet is referred to in some circles as the ""world's water tower' ; the Tibetan plateau is home to vast reserves of glaciated water, the sources of 10 of the largest rivers in Asia, including the Yellow, Yangtze, Mekong, Brahmaputra, Salween, Hindus and Sutlej among others. By some estimates, the Tibetan plateau is the source of fresh water for fully a quarter of the world's population.""",Sharife 2008,2.009
CN,2006.0,,Dam protester executed in China,"Chinese authorities execute a man who took part in protests against the Pubugou dam in Sichuan province in 2004 (see China 2004 entry). Chen Tao is convicted of killing a policeman, but is executed before legal appeals are completed.",British Broadcasting Corporation (BBC) 2006d,2.009
CN,2004.0,,Police kill dam protestor in China,"Tens of thousands of farmers stage a sit-in against the construction of the Pubugou dam on the Dadu River in Sichuan Province, China. Riot police are deployed to quell the unrest and one person is killed. Witnesses also report the deaths of a number of residents.",Lim 2004,2.009
CN,2004.0,,Taiwan to target China's water in defense?,"A 2004 Pentagon report on China's military capacity raises the concept of Taipei adopting military systems capable of being used as a tool for deterring Chinese military coercion by ""presenting credible threats to China's urban population or high-value targets, such as the Three Gorges Dam."" China promptly denounces ""a U.S. suggestion' that Taiwan's Military target the Three Gorges dam, leading the US to deny that it had so urged.",China Daily 2004a,2.009
CN,2003.0,,"A man poisons a drinking water reservoir in Henan Province, China, sickening more than 60 people, in order to boost sales of his","A man who sells water purifiers poisons a reservoir in Ruyang County, Henan Province, China, sickening at least 64 people. The man claims that he wanted to improve sales of his product.",Mohtadi and Murshid 2006,2.009
CN,2001.0,,Chinese protestors block canal,"In an act to protest the destruction of fisheries from uncontrolled water pollution, fishermen in northern Jiaxing City, Zhejiang Province, dam a large industrial wastewater canal for 23 days. The wastewater discharges into the neighboring Shengze Town, Jiangsu Province, killing fish and threatening public health.",China Ministry of Water Resources 2001,2.009
CN,2000.0,,Riots in northern China,"Civil unrest erupts over use and allocation of water from Baiyang Lake, the largest natural lake in northern China. Several people die in riots by villagers in July 2000 in Shandong after officials cut off water supplies. In August 2000, six die when officials in the southern province of Guangdong blow up a water channel to prevent a neighboring county from diverting water.",Pottinger 2000,2.009
CN,1999.0,,Chinese farmers fight over water,"Around the Chinese New Year, farmers from Hebei and Henan Provinces fight over limited water resources. Heavy weapons, including mortars and bombs, are used and nearly 100 villagers are injured. Houses and facilities are damaged and the total loss reaches one million $US.",China Water Resources Daily 2002,2.009
CN,1992.0,,Canal on China's Zhang River bombed,"In August 1992, bombs are set off along a Zhang River distribution canal collapsing part of the canal and causing flooding and economic losses. Violence continues in the late 1990s with confrontations, mortar attacks, and bombings. Conflicts over excessive water withdrawals and subsequent water shortages from China's Zhang River have been worsening for over three decades. (See also entries for 1970, 1976, 1991, and 1999.)",China Water Resources Daily 2002,2.009
CN,1992.0,,"Dispute over control of Zhang River, China leads to violence","In August 1992, farmers of Baishan village in Hebei province and Panyang village in Henan province fight with rudimentary explosives over control of water from the Zhang River, which feeds an irrigation canal for the two provinces. An attempt to divert the river leads to a confrontation and an attack on irrigation canals.",Pietz 2015,2.009
CN,1991.0,,Chinese villages exhange mortar fire over water diversion,"In December 1991, Huanglongkou village and Qianyu village exchange mortar fire over the construction of new water diversion facilities. Conflicts over excessive water withdrawals and subsequent water shortages from China's Zhang River have been worsening for over three decades. (See also entries for 1970, 1976, 1992, and 1999.)",China Water Resources Daily 2002,2.009
LK,2013.0,,Sri Lankan archbishop accuses army of killing unarmed protestors,"The Catholic Archbishop of Colombo, Sri Lanka accuses the Sri Lankan army of shooting unarmed protesters and desecrating a church during demonstrations against water contamination. In the incident, at least six people are reported killed and more than 50 others wounded. Thousands of residents were protesting against the contamination of groundwater supply to 15 local villages, allegedly by chemical waste from a rubber glove factory.",Al Jazeera 2013,2.136
LK,2006.0,,Sri Lankan rebels cut water supplies,"A major battle between the Liberation Tigers of Tamil Eelam (Tamil Tigers, LTTE) and the Sri Lankan Armed Forces takes place in July and August 2006 around the watershed of the Mavil Aru (Mother River) in the Kallar area of Trincomalee district. The Mavil Aru, a tributary of the Mahaweli River, supplies water to 20,000 villagers in the eastern Sri Lanka. The sluice-gates of the waterway are captured and closed by the LTTE, cutting off water supplies and leading to a major operation against them by the Sri Lankan military. The armed forces launch air strikes with the aim of capturing the waterway and sluice-gates, which was achieved on August 11, 2006.",British Broadcasting Corporation (BBC) 2006b,2.136
LK,2006.0,,Bomb attached to police vehicle carrying water supplies injures three,"Three police officers are injured after a bomb explodes from underneath a water truck in Vavuniya District, Sri Lanka.",RAND Database of Worldwide Terrorism Incidents 2018,2.136
LK,2006.0,,"An explosion damages a water pipeline supplying water to parts of Sri Lanka's capital, Colombo and surrounding suburbs","An explosion damages a water pipeline that supplies water to parts of Sri Lanka's capital, Colombo, and surrounding suburbs. Tens of thousands of homes are without potable water as a consequence.  No group  claims responsibility but the act of sabotage occurs shortly after the Sri Lankan government reinvokes anti-terrorism legislation.",National Consortium for the Study of Terrorism and Responses to Terrorism (START) 2018. ID. 200610120005,2.136
KZ,2013.0,,Kyrgyz villagers block canal at border,A water and land dispute between villagers living on the border between Kazakhstan and Kyrgyzstan escalates when Kyrgyz villages block a canal to prevent water flowing to farmers on the Kazakh side of the border.,Lillis 2013,1.98
KZ,2000.0,,Central Asian nations cut off water to neighbors,Kyrgyzstan cuts off water to Kazakhstan until coal is delivered; Uzbekistan cuts off water to Kazakhstan for non-payment of debt.,Pannier 2000,1.98
KZ,1997.0,,Uzbekistan cuts downstream flow to Kazakhstan,"Uzbekistan raises regional tensions by cutting off 70 percent of flow downstream, threatening 100,000 hectares and prompting a riot by Kazakh farmers.",Hogan 2000a,1.98
KZ,1999.0,,Tajikistan releases water from Kairakum reservoir,"In summer 1999, Tajikistan releases 700 million cubic meters of water from the Kairakum reservoir without warning its downstream neighbors. Among other effects, this cuts water to cotton crops in southern Kazakhstan, causing significant losses to farmers. At the same time, Kyrgyzstan cuts flows to southern Kazakhstan in retaliation for Kazakhstan's failure to supply coal under barter agreements.",Hogan 2000b,1.98
PS,2010.0,2015.0,Israel impedes water supply to new West Bank development,"The construction and completion of a billion-dollar new middle-class Palestinian city of Rawabi in the West Bank is slowed and delayed for years while the Israeli government withholds access to basic water supplies. The delay is due, in part, to a larger dispute over the actions of the Israeli-Palestinian Joint Water Committee. In March 2015, the supply of water to Rawabi is finally approved. However, the supply is only sufficient for the 640 families that currently live there; far less than what will be needed for the 25,000 residents that the city will eventually house.",Shuttleworth 2015,2.538
PS,2019.0,,Israel reportedly cuts off water supplies to approximately 1500 Palestinians,"Palestine News Network reports a water shut off to 17 Palestinian communities in Hebron, West Bank. The report suggests that the shut off was a purposeful act by Israel to force the movement of local Palestinians out of their homes to make room for more Israeli settlements.",Sputnik 2019,2.538
PS,2019.0,,One Israeli killed and two others injured at a spring in the West Bank,"A homemade bomb explodes at a spring, killing an Israeli teenager and injuring her father and brother. Springs in the occupied West Bank area have become hotspots for conflict between Israeli and Palestinian citizens who both visit during the summer while seeking to cool off from the heat.",Chronicle News Service 2019,2.538
PS,2017.0,,Israeli forces destroy water pipes in the West Bank,"Israeli forces destroy water pipes in a rural area, leading to clashes between Israeli forces and local Palestinians in Jenin, West Bank, Palestine.",Raleigh et al 2010 ID. 339843,2.538
PS,2014.0,,Israel damages water and wastewater systems in Gaza,"During the 2014 Israel-Gaza conflict, Gaza's water infrastructure is heavily damaged. The World Health Organization and other aid groups report that a water facility, wastewater treatment plants, and a desalination facility are damaged by Israeli military action. Moreover, electricity shortages impede the ability of the remaining wastewater treatment plants to function effectively.",Kershner and Akramjuly 2014,2.538
PS,2014.0,,Palestinian water supply and wastewater system hit by Israeli war planes,"Israeli warplanes hit water supply wells, pipelines, and wastewater treatment plants servicing hundreds of thousands of Palestinians in the Gaza region. Palestinian officials state that the attacks intentionally targeted the infrastructure, mounting a a war crime under the Geneva Protocol.",Omer 2014,2.538
PS,2013.0,,Blockade causes shutdown of Gaza wastewater treatment plant,"An Egyptian and Israel blockade of Gaza cut fuel supplies and causes a shutdown of Gaza's wastewater treatment plants, leading to massive overflow of sewage.",Al-Mughrabi 2013,2.538
PS,2007.0,,Israel's sanctions against Gaza cause water shortages,"Israel's sanctions against Gaza cause water shortages and a growing public health risk. In particular, restrictions on fuel, spare parts, and maintenance equipment threaten the functioning of Gaza's already limited water and sanitation system.",Oxfam 2007,2.538
PS,2004.0,,US halts water projects in Gaza,The United States halts two water development projects as punishment to the Palestinian Authority for their failure to find those responsible for a deadly attack on a US diplomatic convoy in October 2003.,Associated Press (AP) 2004,2.538
PS,2000.0,,"Settlers attack a village in Palestine, injuring civilians and cutting water supply","In a village in Palestine, three Palestinians are injured by gunshots from Israeli settlers. The same settlers also cut the water supply to the village by damaging the pipes.",RAND Database of Worldwide Terrorism Incidents 2018,2.538
PS,2000.0,,Israeli settlers are accused of intentionally releasing sewage to contaminate Palestinian agricultural fields in the West Bank,Israeli settlers from Efrat are blamed for deliberately releasing sewer water into Palestinian agricultural fields in the West Bank.,Mohtadi and Murshid 2006,2.538
PS,2011.0,,Israeli settlers destroy wells in attack on West Bank village,"Israelis from nearby settlements attack Qasra, a West Bank village of 6,000, destroying crops and a water well. Attackers previously burned down a mosque and damaged hundreds of olive trees.",Bsharat and Ramadan 2011,2.538
PS,2011.0,,Israel destroys Palestinians' water pumps and wells,"Israel's military destroys nine water tanks in the Bedouin village of Amniyr in the South Hebron Hills, in the West Bank, Palestine. Later, soldiers destroy pumps and wells in the Jordan Valley villages of Al-Nasriyah, Al-Aqrabiyah, and Beit Hassan.",Aburawa 2011,2.538
PS,2001.0,,Palestinians destroy water supply to Israeli settlements,"Palestinians destroy water supply pipelines to the West Bank settlement of Yitzhar and to Kibbutz Kissufim. The Agbat Jabar refugee camp near Jericho disconnects from its water supply after Palestinians loot and damage local water pumps. Palestinians accuse Israel of destroying a water cistern, blocking water tanker deliveries, and attacking materials for a wastewater treatment project.",Israel Line 2001a,2.538
CG,2013.0,,"Water supply for the city of Kitchanga, Congo cut off resulting in deaths","The water supply for the city of Kitshanga, Congo is cut off in clashes between DRC armed forces and the Alliance des Patriotes pour un Congo Libre et Souverain (APCLS). The violence kills tens of civilians, including a humanitarian worker, wounds hundreds of people, and displaces thousands.",UN News Service 2013,2.21
BR,2012.0,,Brazilian landowners poison tribe's water,"Brazil's federal police respond to reports that water used by the indigenous Guarani-Kaiowa tribe was poisoned by nearby landowners attempting to gain control over disputed land. Since 2009, the dispute has led to the deaths of three tribesmen, who say the water runs through sacred land.",Associated Press (AP) 2012a,2.462
BR,2012.0,,"Protestors burn buildings at Belo Monte Dam site, Brazil",Work on the controversial $13 billion Belo Monte dam is halted after protesters burn buildings at three dam sites.,Borisov 2012,2.462
BR,2012.0,,Killings in water conflicts in Brazil,"Northeastern Brazil sees growing conflicts after severe drought reduces water availability. News agencies report that one person a day is being killed from ""water wars,"" which involve locals fighting over scarce supplies.",Catholic Online 2012,2.462
UZ,2012.0,,Uzbekistan cuts gas over Tajik dam project,Uzbekistan cuts natural gas deliveries to Tajikistan in retaliation over a Tajik hydroelectric dam which Uzbeks say will disrupt water supplies. Gas flows resumed after a new contract is signed.,Kozhevnikov 2012,2.033
UZ,1997.0,,Uzbekistan cuts downstream flow to Kazakhstan,"Uzbekistan raises regional tensions by cutting off 70 percent of flow downstream, threatening 100,000 hectares and prompting a riot by Kazakh farmers.",Hogan 2000a,2.033
UZ,1992.0,,Violent raids target water infrastructure between Uzbekistan and Turkmenistan,"The Tyuyamuyun reservoir in the delta of the Amu Darya is a point of contention between Uzbekistan and Turkmenistan. Violence occurrs in 1992 over the re-direction of drainage waters and raids by both sides to cut off pipes and irrigation canals. Today, the Tyuyamuyun remains one of several disputed areas in continuing water dispute with Uzbekistan.",Votrin 2003,2.033
