country,Date,Until,Headline,Description,Sources,MostPeaceful2023GPI
KE,2003.0,,Students protest lack of water supply,"Students protest against poor conditions at Mombasa Polytechnic University in Kenya, including lack of water supply and proper sanitation. The protest leads to riots and police intervene.","Raleigh et al N.D. I.D. 4990667, 4990686",2.254
KE,2001.0,,Deadly fight between Kenyan herders and farmers,"At least 130 people are killed in a string of clashes between Pokomo farmers and Orma, semi-nomadic cattle herders over access to land and river water.",Agence France-Presse (AFP) 2012a,2.254
KE,2001.0,,Twenty people are killed over access to fresh water,Twenty people total are killed in clashes between Orma and Pokomo ethnic groups over access to fresh water in Kenya.,Raleigh et al N.D. I.D. 5274186,2.254
KE,2001.0,,Clashes between ethnic groups over access to water,Clashes occur between Pokomo and Wordei ethnic groups over access to a water fresh source in Kenya.,"Raleigh et al N.D. I.D. 5274071, 5274070, 5274069, 5274068",2.254
KE,2000.0,,Kenyans battle monkeys for drought relief,A clash between villagers and thirsty monkeys leaves eight apes dead and ten villagers wounded. The duel starts after water tankers bring water to a drought-stricken area and monkeys desperate for water attack the villagers.,British Broadcasting Corporation (BBC) 2000,2.254
KE,2012.0,,Violent conflict among Kenyan and Ugandan herders,"Tensions lead to violence between Uganda and Kenya after Kenyan Pokot herdsmen cross the border seeking water and pasture. In October, the Ugandan government sends 5,000 soldiers to control violence among pastoralists from the two countries.",Bii 2012,2.254
KE,2000.0,,Students riot to protest water shortages,Students riot to protest water shortages in Kenya.,"Raleigh et al N.D. I.D. 5273804, 5001531",2.254
KE,1996.0,,Orma and Degodia clans wage war over scarce resources in Kenya,"The Orma and Degoodi clans wage war over grazing land and water due to a severe drought, with 10 fatalities.",Salehyan et al 2014,2.254
KE,1993.0,,Violence occurs over land use of a water catchment area in Kenya,"In October 1993, violence erupts in the Narok district of Kenya's Rift Valley province. Maasai warriors attack immigrant Kikuyu settlers and massacre at least 17 of them, after Kikuyi settlers allegedly mutilated Maasai cattle. 16 more Kikuyus are killed in other parts of Narok and the rest of the Kikuyu population is forced out of the area and into refugee camps. Environmental concerns played a central role: a few months previously, the Narok County Council had declared Enosupukia, the site of the conflict, to be a water catchment area and decreed that all inhabitants, mostly transplanted Kikuyus, had to leave.",Cerami 2013,2.254
NG,2011.0,2018.0,Continued conflict over water between herdmen and farmers,"Scarce water and land resources have forced herdsmen, mainly of the Fulani ethnic group, to move into regions of the country that are used as farmland, leading to deathly conflicts between the herdsmen and farmers. In 2016 alone these conflicts led to 2,500 deaths. The violence has continued into 2018.",Ritter 2018,2.713
NG,2018.0,,11 deaths attributed to ongoing conflict between herdsmen and farmers,"11 are killed and 11 more injured during an attack by Fulani herdsmen on a farming community in Central Nigeria, ignited by the continuing conflict over land and water resources.",Associated Press (AP) 2018a,2.713
NG,2018.0,,A large number of deaths is reported in attack on farmers by armed herdsmen in Nigeria over water and land resources,"On a single day in Nigeria's Plateau state, an attack by armed herdsmen leaves dozens in farming communities dead. This attack is part of ongoing violence that is in part triggered by access to water and land resources. Reports vary in the number dead; one cites 200 and another, 86.",Agence France-Presse (AFP) 2018b,2.713
NG,2017.0,,"Protests over inadequate water, food, and healthcare lead to 10 arrests in Nigeria","Ten people who had been uprooted from their homes by Boko Haram are arrested when protesting for better water, food, and healthcare at their temporary camps in Konduga, Borno, Nigeria.",News 24 2017,2.713
NG,2014.0,,Farmers and herdsmen clash over land and water access,"In Nigeria, Tiv/Agatu farmers and Fulanis herdsmen clash over access to grazing land and water points. In April 2014, President Goodluck Jonathan orders military operations in Benue, Nasarawa, and Plateau states in an effort to reduce the violence.",All Africa 2014,2.713
NG,2014.0,,Over 1000 killed in Nigeria over access to land and water,"Violence between farmers and herders kills over 1,000 people in 2014 in Nigeria alone, according to Human Rights Watch. At the root of this violence is the issue of access to land and water resources.",McAleer 2014,2.713
NG,2008.0,,Violent protests in Nigeria,"A protest over the price of water in Nyanya, Abuja, Nigeria results in violence, including the beating of water vendors.",Yakubu 2008,2.713
NG,2004.0,,Students protest over water shortages,Students protest over water shortages.,"Raleigh et al N.D. I.D. 5285986, 5285968, 5285957",2.713
NG,2003.0,,Women block water access to a Naval base,"A group of women on canoes protest safeguards on oil standards by blocking water access to a naval base in the Niger Delta, Nigeria.",Raleigh et al N.D. I.D. 5294140,2.713
NG,1997.0,,Police prevent students from protesting the lack of water on campus,Three students are seriously wounded in a clash with police at the University of Ibadan in Nigeria. Police are preventing students from protesting the lack of water and electricity on campus.,Raleigh et al N.D. I.D. 5286570,2.713
CI,2004.0,,Riots over water shortage kill prisoners,"There are two incidents in early November at Abidjan's main jail, La Maison d'arr?t et de correction d'Abidjan (MACA) , in which prisoners are killed. The first incident is sparked by a lengthy water shortage; prisoners reportedly had not had water for 5 days except for small rations of drinking water. At least 7 prisoners die and 30 are injured in the ensuing riots. U.N. human rights officials said they were investigating the riot and could not give a final death toll.",US Department of State 2005,2.053
CI,2004.0,,Government shuts off electricity and water supplies in northern Cote d'lvoire,"On November 4, the army carries out ""Operation Dignity"" and mounts surprise attacks on Bouake, stronghold of opposition forces and the largest city in the north, shattering an 18-month ceasefire. The Government cuts off electricity and water supplies to the north the day before the attacks. They remain off for about a week.",US Department of State 2005,2.053
CI,2002.0,,"Youths destroy local water, electric, and telecommunication facilities in Cote d'lvoire","On October 10, youths claiming to be members of the Group of Patriots for Peace (GPP) destroy facilities of the Ivoirian Water Distribution Company, the Ivoirian Electricity Company, and C?te d'Ivoire Telecommunications. Demonstrators say they were protesting the ""free"" supply of water, electricity, and telephone in rebel-controlled areas.",US Department of State 2004,2.053
CI,2002.0,,Four wells found with human remains in Cote d'lvoire,"Conflict between the government of Laurent Gbagbo and opposing rebel forces leads to extensive violence and regional conflict. In late September 2002, there are reports of several mass graves discovered in the Bangolo. In Zeregbo and Bahably, four water wells are found with human remains. Early reports indicate that western rebel groups who captured the area killed the persons in the mass graves and wells between December 2002 and January 2003.",US Department of State 2004,2.053
CI,2004.0,,Riots in prison over water shortage,Riots occur at the main prison in Abidjan over a water shortage.,"Raleigh et al N.D. I.D. 5249959, 5249958, 5249956, 5249955",2.053
GT,2009.0,2011.0,Hydroelectric construction company hires armed private security to quell local opposition in Guatemala,"In the Q'anjob'al and Chug Territory of northern Huehuetenango, Guatemala, three proposed hydroelectric projects supported by the national government incite strong local opposition. The hydroelectric construction company hires armed private security personnel to quell confrontations and acts of vandalism.",Environmental Justice Atlas 2018,2.13
GT,2007.0,2017.0,A review of violence in Guatemala identifies more than 60 environmental activists killed and other instances of violence between,"Research by a professor at the University of Regina, Canada, finds that between 2007 and 2017 at least 61 Guatemalan activists were murdered for their work protecting rivers, lands, and the people who depend on them for their livelihoods.",Granovsky-Larsen 2018,2.13
GT,2018.0,,Brothers murdered for opposing hydropower project in Guatemala,Neri and Domingo Esteban Pedro were found murdered near the San Andres hydroelectric project on the Yal Witz River in western Guatemala. The brothers were vocal opponents of the project.,Ramon 2018,2.13
GT,2017.0,,Community demonstrator murdered while protesting local hydroelectric projects,"Don Sebastian Alonzo Juan, 72, is shot and killed while participating in a peaceful community demonstration in Yichkisis, village of San Mateo Ixtatan, Huehuetenango, Guatemala, against three local hydroelectric projects. The shots are reportedly fired by the private security guards hired by the hydroelectric project company.",Simon 2018,2.13
GT,2014.0,,Pojom II hydroelectric project facilities set on fire,The Pojom II hydroelectric project facilities are set on fire. This is one of three proposed hydroelectric projects in the northern Huehuetenango region of Guatemala that has been opposed by many of the local community.,Environmental Justice Atlas 2018,2.13
GT,2010.0,,Guatemalans mine protestors shot,Two unidentified gunmen on a motorbike shoot an activist protesting the impacts of mining on water quality and local water rights.,Amnesty International 2012,2.13
SD,2003.0,2007.0,Sudan targets water in civil war,"The ongoing civil war in the Sudan has included violence against water resources. In 2003, villagers from around Tina said that bombings had destroyed water wells. In Khasan Basao they alleged that water wells were poisoned. In 2004, wells in Darfur were intentionally contaminated as part of a strategy of harassment against displaced populations.",Amnesty International 2004,3.023
SD,2019.0,,A fight over the price of water leads to deadly clashes in Sudan,"A woman was killed in a dispute over the price of water in El Gedaref, Sudan. This violent clash triggers more fighting between familial groups, leading to at least eight more deaths and dozens of injuries.",Dabanga 2019,3.023
SD,2017.0,,Clashes in Darfur between farmers and herders over water access result in deaths,At least 70 people have been killed in the past few months in clashes between farmers and herders over access to water resources and land in the southern part of Darfur.,UN News Centre 2017,3.023
SD,2017.0,,11 injured in clashes between farmers and herdsmen over access to water,"Eleven people are injured after clashes between herdsmen over a water point in South Kordofan, Sudan.",Raleigh et al 2010 ID. 318310,3.023
SD,2017.0,,Civilians protesting lack of access to water are reportedly beaten and tortured,"Five people from a citizen water committee and local police in El Fasher, North Darfur, Sudan, are reportedly beaten and tortured by military officers after asking the military to allow local residents to organize and take water from a local source. Residents stage protests against the violent reaction of the military.",Sudanese Online 2017,3.023
SD,2017.0,,Fighting between two clans in Sudan over ownership of water point leaves six dead,"Fighting between two clans near Lagawa, West Kordofan, Sudan over ownership of a water point leaves six dead and several others wounded.",Raleigh et al 2010 ID. 318582,3.023
SD,2017.0,,"Four people killed in clash over access to a water point in North Darfur, Sudan","Former Sudan Liberation Army-Abdul Wahid (SLA-AW) rebels and Arab nomads clash over access to a water point in Kebkabiya, North Darfur, Sudan, resulting in the death of a total of four people from both sides of the conflict.",Raleigh et al 2010 ID. 318587,3.023
SD,2017.0,,Protests over water outages turn violent in Sudan,"People protesting water outages are dispersed by police officers in Port Sudan, Red Sea, Sudan.",Raleigh et al 2010 ID. 318759,3.023
SD,2016.0,,Guard at water well in the Sudan is attacked,"A guard at water wells in the Um Burma area, Sudan is attacked and severely injured by paramilitaries.",Dabanga 2016,3.023
SD,2014.0,,"Militia burn and loot South Darfur refugee camp, destroying water wells","Armed Janjaweed militia burn and loot a South Darfur refugee camp, killing a local sheikh, injuring others, looting property and livestock, and destroying all water wells.",Radio Dabanga 2014,3.023
SD,2008.0,,Unknown gunmen kidnap four Sudanese government drivers of the state water corporation,"Unknown gunmen kidnap four Sudanese government drivers of the state water corporation in Um Tajok, Darfur and steal a drilling rig. It is not known if the kidnapped persons and drilling rig are returned.",National Consortium for the Study of Terrorism and Responses to Terrorism (START) 2018. ID. 200803200009,3.023
SD,2008.0,,Assailants attempt to damage a water pump outside of a refugee camp in Darfur,"At the Hassa Hissa camp near Zalinjay, Gharb Darfur, Sudan, ten assailants attempt to damage a water pump outside of an internally displaced person (IDP) camp. The armed men open fire on the pump and set fire to the pump and five generators. The assailants fight with occupants of the camp, wounding one. No group claims responsibility, although it is widely believed the Janjaweed Militia is responsible.",National Consortium for the Study of Terrorism and Responses to Terrorism (START) 2018. ID. 200812010034,3.023
SD,2007.0,,Violent protests against the Kajbar Dam in Sudan,Angry villagers in the Sudan stage protests against Kajbar Dam; four villagers are killed by government militia.,Bosshard 2009,3.023
SD,2006.0,,Sudanese anti-dam militia attacks school,"Militia of the Merowe Dam Militia Implementation Unit in the Sudan attack a gathering of villagers concerned about the community impacts of the dam at a school in Amri village, killing three farmers and injuring more than 50 others.",Bosshard 2009,3.023
SD,2004.0,,Militias smash water wells,Janjaweed militias smash water wells and burn both food and seeds in the Jebel Marra area. They also allegedly throw dead bodies into some open wells.,Raleigh et al N.D. I.D. 5576261,3.023
SD,2004.0,,Rebels destroy offices of local water utility,Rebels destroy several houses and the offices of the local police and water utility.,"Raleigh et al N.D. I.D. 4987151, 4987157",3.023
SD,2000.0,,Clashes between rioters and police over water shortages,Sudanese rioters who are protesting against the failure of schools to reopen as well as water and electricity shortages clash with police who intervene to quell the riot. At least one student is killed and many are injured.,Raleigh et al N.D. I.D. 5576946,3.023
SD,1998.0,,Clashes between rival tribes over water,"Clashes between rival tribes (Rezaigat and Massalit) over water and grazing rights leave more than 100 people dead and about 45 villages gutted in West Darfur, Sudan.",Raleigh et al N.D. I.D. 5328198,3.023
EC,2002.0,2016.0,Community opposition to a hydroelectric dam project in Ecuador results in numerous violent confrontations,"A hydroelectric dam project proposed for the Dulcepamba River in Ecuador is the target of local community opposition and protests are staged to block the project. Clashes between the local communities, hired security guards, and state police leave several protestors injured. The communities also receive violent threats from police. Two community members are arrested. In 2015 the construction of the hydroelectric dam begins, flooding properties and destroying farmland.",Environmental Justice Atlas 2019,2.095
EC,1995.0,,"Ecuador, Peru fight over Cenepa River",Armed skirmishes arise in part because of disagreement over the control of the headwaters of Cenepa River. Wolf argues that this is primarily a border dispute simply coinciding with location of a water resource.,Samson and Charrier 1997,2.095
ML,2019.0,,37 killed in herder-farmer conflict over water and land resources in Mali,37 civilians are killed in the ongoing conflict between herders and farmers who are fighting over access to water and land resources in central Mali.,Agence France-Press (AFP) 2019c,2.963
ML,2019.0,,More than 130 killed in Mali in conflict between hunters and herders over land and water,"More than 130 people are killed in the conflict between hunter and herder communities in Mali. In this instance, Dogon hunters are accused of attacking Fulani herders.",TRT World 2019,2.963
ML,2019.0,,"50,000 people flee their homes in central Mali as conflict escalates over land and water","A series of massacres in central Mali, fueled by conflict over land and water resources, causes 50,000 people to flee their homes.",Webb 2019,2.963
ML,2018.0,,"At least 8 more killed in ongoing conflict over access to water between farmers and herders, Mali","At least eight more people die in an ongoing conflict between the Fulani and Dogon communities in Mali near the town of Koro, sparked by access to water and grazing disputes. Since March 2018, the total death toll from this ongoing conflict is reported to be 25.",Agence France-Presse (AFP) 2018a,2.963
ML,2017.0,,Water pumps destroyed in conflict over access to water in Mali,"People identified as militants destroy several water pumps and a number of fields and seize cattle in Kewa, Djenne, Mopti, Mali.",Raleigh et al 2010 ID. 247138,2.963
ML,2013.0,,Islamic militants cut water supply to Timbuktu,"Attacks by Islamic militants on utilities cut water supply to Timbuktu, Mali. There are also reports that Malian forces carried out executions in the conflict area near the towns of Sevare, Mopti, and Niono with bodies being dumped in water wells.",Formanek Smith-Spark and Netto 2013,2.963
ML,2008.0,,Security forces open fire on water privitization protesters in Mali,"One person is killed and five injured when security forces open fire on protests over an attempt to privatize water services in Lere, northwestern Mali.",Agence France-Presse (AFP) 2008,2.963
ML,2002.0,,Protests over the increase in water tariffs,"Protesters in Bamako, Mali protest the increase of water and power tariffs by the government.",Raleigh et al N.D. I.D. 5566892,2.963
ML,1999.0,,Fighting breaks out over the use of a watering hole,Malian herdsmen in Missira-Samoura refuse to allow a horseman from Mauritania to use a watering hole. The Mauritanian horseman rides off and returns to the village with other men. Fighting breaks out and results in two people being killed.,Raleigh et al N.D. I.D. 5281066,2.963
ML,2012.0,,Water clash on border of Mali and Burkina Faso,"A clash along the border between Dogon villagers from Mali and nomadic Fulani herders from Burkina Faso kills at least 30 people, after an earlier agreement to share water and pasture land was revoked. Chaos following a military coup in March is partly responsible for the breakdown in law and order in Mali.",Xinhua News 2012a,2.963
TD,2019.0,,Disputes between herders and farmers over access to water lead to growing violence in Chad,Herders and farmers who used to coexist peacefully are now inflicting deadly wounds on each other over fights driven by water shortages in the Sahel region of Chad.,Agence France-Presse (AFP) 2019a,2.699
IN,2019.0,,One death reported in a fight over water in southern India during a severe heat wave,"In Tamil Nadu, India, a 33 year old man dies as the result of a fight that broke out over water. India is experiencing a heat wave with temperatures reaching higher than 50 degrees C/120 degrees F.",Agence France-Presse (AFP) 2019b,2.314
IN,2019.0,,"One man stabs six others in a fight over water shortages in Ranchi, India during severe heat wave","In Ranchi, India, one man stabs six other people due to water shortages. India is experiencing a heat wave with temperatures reaching higher than 50 degrees C/120 degrees F.",Agence France-Presse (AFP) 2019b,2.314
IN,2019.0,,India responds to deadly attack by threatening to curtal water deliveries to Pakistan,"An attack by a Pakistan-based group that killed at least 40 Indian soldiers has worsened tensions between the two countries, prompting Indian leaders to threaten to curtail water deliveries from rivers flowing into Pakistan. Curtailment of water deliveries could undermine the 1960 Indus Water Treaty, which stipulates the sharing of water resources between the two countries.",Al Jazeera 2019,2.314
IN,2019.0,,A man is stabbed by his neighbor over a water sharing dispute in India,"A man is stabbed by his neighbor over a water sharing dispute in Chennai, India. Current drought and water supply management problems have led to lack of water for millions living in the city.",British Broadcasting Corporation (BBC) 2019,2.314
IN,2019.0,,A grandmother and her grandson are beaten when seeking water from a private well,"A grandmother and her grandson in a small village in India insist on being allowed to use a private well to get water. The well owner refuses and sends men to beat the grandmother and grandson with sticks, injuring them both. The owner is concerned that his well cannot provide water to the entire village and therefore, he does not want to provide water to anyone.",Indo-Asian News Service 2019,2.314
IN,2019.0,,"Numerous fights, including attacks on water tankers, break out over access to water in Madhya Pradesh, India during severe heat","Water shortages in Madhya Pradesh, India intensify during a heat wave, leading to numerous violent conflicts among Indian civilians. In one instance in Khajrana a water truck driver is beaten. In another instance in Panna, eight people are injured during a fight. The local government responds to the violence by ordering police to escort water trucks.",Times of India 2019,2.314
IN,2019.0,,Two men are seriously injured in clash over access to water in India,"Two men are seriously injured in a clash over water in Krishna Nagar Colony, India.",Times of India 2019,2.314
IN,2018.0,,Water shortages in India lead to deadly fights between civilians and harassment of water company employees,"Lack of water in cities across India -- due to drought, growing populations, and inadequate infrastructure -- leads to high tensions, resulting in at least two deaths when a fight breaks out between residents waiting in line at a water truck. Those working for the water companies with the responsibility of turning different water lines on and off, called ""key men,"" are increasingly harassed by residents wanting to persuade them to keep their water on.",Abi-Habib and Kumar 2018,2.314
IN,2017.0,,"Police kill five farmers during protests over water shortages in Madhya Pradesh, India","Water shortages due to drought and mismanagement contribute to violent unrest of farmers in Madhya Pradesh, India. During one protest, police shoot into a crowd, killing five protestors.",Wu 2017,2.314
IN,2016.0,,Scarce water supplies in drought regions of India spark violence,"Scarce water supplies in drought-hit regions of India spark violence. As northern and central India suffer thorough severe drought and heat, police in Bundelkhand and several other regions including Tikamgarh are reporting a rise in violent, often deadly clashes over water. Indian police report that the fighting is getting more frequent and bloody, with numerous injuries and deaths reported.",Niazi 2016a,2.314
IN,2016.0,,Protests against the building of dams on the Brahmaputra River in India,"Protests against the building of dams on the Brahmaputra River in India's Himalayan state of Arunachal Pradesh turns violent, leading to two deaths and additional injuries. Both China and India have put forward plans for nearly 150 dams in the region, with major local opposition.","Third Pole, The 2016",2.314
IN,2016.0,,"Riots over water in Bangalore, India","At least two people die and others are injured in riots over water in Bangalore, India in the state of Karnataka. The unrest starts when the Indian Supreme Court orders Karnataka to release water from dams on the Kaveri river to neighboring Tamil Nadu. Over 400 people were arrested.","Mortimer 2016, Gowen 2016",2.314
IN,2016.0,,18 killed and 200 injured after reopening of the Munak canal,"At least 18 people are killed and 200 injured after the Indian Army intervenes to reopen the Munak canal, which supplies New Dehli with three-fifths of its freshwater supply. The canal is shut down by economic protests in Harayana state. Sabotage of the canal left more than 10 million people in India's capital, Delhi, without water.",Sethi 2016,2.314
IN,2016.0,,Armed gaurds clash with farmers over drought-struck region of Bundelkhand,Armed guards and farmers clash over access to water from Jamunia River at the Bari Ghat Dam in the drought-struck region of Bundelkhand.,"Das 2016, Niazi 2016b",2.314
IN,2016.0,,Attack on a local dam in India,"A group of heavily armed militants fire blank rounds of bullets at a dam, creating panic amoung the locals. No casualties are reported.",Nath 2016,2.314
IN,2016.0,,"Water shortage led to clashes between two groups in the parched Sehore district, India","Water shortage led to clashes between two groups in the parched Sehore district, India leaving 7 people injured and one critical.",Times of India 2016,2.314
