country,Date,Until,Headline,Description,Sources,MostPeaceful2023GPI
ET,2018.0,2019.0,"Violence in western Ethiopia, in part driven by shortages of water and land resources, displaces one million people",Violence in western Ethiopia displaces one million people. The violence is in part driven by shortages of water and land resources.,Amare 2019,2.872
ET,2004.0,2006.0,Violence over water in Ethiopia,"At least 250 people killed and many more injured in clashes over water wells and pastoral lands. Villagers call it the ""War of the Well"" and describe ""well warlords, well widows, and well warriors."" A three-year drought has led to extensive violence over limited water resources, worsened by the lack of effective government and central planning.",British Broadcasting Corporation (BBC) 2004,2.872
ET,2018.0,,More than 70 water systems damaged in Ethiopia related to violent conflicts,At least 76 water systems have been damaged by the ongoing conflict in the Oromia region of Ethiopia. The larger conflict leading to these casualties is between different ethnic groups and has displaced hundreds of thousands of people.,UNICEF 2018,2.872
ET,2006.0,,Water clashes kill 40 in Kenya and Ethiopia,"At least 40 people die in Kenya and Ethiopia in continuing clashes over water, livestock, and grazing land. Fighting occurs in the southern Ethiopia in the region of Oromo and the northern Kenya Marsabit district.",Reuters 2006,2.872
ET,2000.0,,Regional drought heightens tensions in Ethiopia and Kenya,"The Ethiopian government says that regional drought worsens traditional conflicts at watering points and over access to pasture. The tensions are heightened by the presence of the Oromo Liberation Front (OLF), an Ethiopian armed opposition group said to be operating from Kenyan territory near the common border.",Norwegian Refugee Council/Global IDP Project 2002,2.872
ET,1998.0,,War between Eritrea and Ethiopia includes destruction of water systems,"During the war with Ethiopia in 1998, many water supply systems in the mountainous region of Debub and Gash Barka in Eritrea are destroyed.",International Committee of the Red Cross (ICRC) 2009,2.872
ET,2012.0,,Egypt and Sudan allegedly target Ethiopia dam,"Information is leaked about an alleged secret agreement that would allow Egypt to build an air base in Sudan to attack the Grand Ethiopian Renaissance Dam (GERD). Egypt is concerned that the dam, under construction in Ethiopia just upstream of Sudan on the Blue Nile, would reduce flows into its territory. The news reports, strongly denied by Egypt, claim that Sudan would allow Egypt to launch attacks if diplomatic efforts fail to resolve water sharing between Egypt and Ethiopia. The allegations are based on an internal 2010 email made available by Wikileaks.",Sudan Tribune 2012,2.872
ET,2009.0,,Village attacked in Ethiopian water pipe conflict,"Ethiopian Somalis attack a Borana community in the Oromia region over ownership of a new borehole being drilled on the disputed border between them. Three people from the Oromia village of Kafa are killed and seven injured, and the entire community driven from their homes. The drilling rig is destroyed, as well.",British Broadcasting Corporation (BBC) 2009,2.872
ET,2008.0,,Multiple civilians killed by remotely-triggered bombs targeting water trucks,At least two water trucks being used to deliver supplies to the Ethiopian army are targeted by remotely-triggered bombs. At least four civilians are killed and another eight are injured.,RAND Database of Worldwide Terrorism Incidents 2018,2.872
ET,2007.0,,A forced displacement campaign by the Ethiopian military includes destruction of water wells and other sources,"During a violent, forced displacement effort by the Ethiopian military, water wells and other water supply sources are destroyed. The Ethiopian military is seeking to move people out of the country side and into larger towns and cities in order to continue their counterinsurgency fight against the Ogaden National Liberation Front. Numerous sources report executions of those who refuse to cooperate.",Human Rights Watch 2008,2.872
ET,2007.0,,Soldiers threaten to throw woman into a well and drown her if she does not comply,"A 20-year-old woman reports that prior to being beat by military forces, she was threatened with drowning in a well if she does not comply. This report is associated with reports soldiers guarding water holes and of other human rights abuses by the Ethiopian military from their campaign to defeat the Ogaden National Liberation Front.",Human Rights Watch 2008,2.872
ET,2006.0,,Violent water clashes in Somali Region,At least 12 people die and over 20 are wounded in clashes over competition for water and pasture in the Somali border region.,British Broadcasting Corporation (BBC) 2006a,2.872
ET,2000.0,,Ethiopian killed in water fight,One man stabbed to death during fight over clean water during famine in Ethiopia.,Sandrasagra 2000,2.872
SS,2018.0,2019.0,War and soaring temperatures leave women and children water collectors vulnerable in South Sudan,"War and soaring temperatures leave many rural communities in South Sudan with little or no local water sources. Women and children are subjected to violent attacks, rape, and murder when traveling to regional sources to collect water. Leaders report conflicts sparked by water shortages occurring between the many of the 60 different ethnic groups across the country.",Trew 2019,3.221
SS,2011.0,2018.0,Water infrastructure is a casualty of the ongoing conflict in South Sudan,"Since South Sudan's independence in 2011, ongoing violent conflicts have harmed and destroyed water infrastructure  across the country.",Ritter 2019,3.221
SS,2019.0,,Water shortages linked to child kidnappings in South Sudan,"Local authorities cite water shortages as a growing influence on the number child kidnappings in the Boma region of South Sudan. When there is a water shortage, shepherding communities spend more time on the move seeking water for their livestock, but, as a side business, they will also abduct children who can then be resold for profit.",Trew 2019,3.221
SS,2017.0,,Violence between herdsmen and farmers over access to water and pasture,Local militia allegedly supported by the Sudan People's Liberation Army attack Kenyan herdsmen who crossed the border in search of water and pasture for their cattle.,Raleigh et al 2010 ID. 307066,3.221
SS,2017.0,,38 killed; 30 injured in fighting over access to water and land in South Sudan,"According to a report, 38 people are killed and another 30 are injured in fighting between two local clans over water points, grazing land, and border areas, in Gogrial West, Warrap, South Sudan.",AAP 2017,3.221
SS,2017.0,,"Violent clashes in South Sudan lead to 10 dead, many wounded, and destruction of a water point","Violent clashes between government and the Sudan People's Liberation Movement-In Opposition (SPLA-IO) cause the destruction of a water point and leave a reported 10 people dead and 16 more wounded in Wichok, Rubkona, Unity, South Sudan.",Raleigh et al 2010 ID. 307870,3.221
SS,2014.0,,Water pipeline destroyed in South Sudan,"Fighting around Malakal, in South Sudan, displaces thousands and leaves many dead. A military checkpoint and water pipeline to the United Nations Mission in South Sudan (UNMISS) compound and nearby Protection of Civilians area are targeted and destroyed.",World Vision 2014,3.221
SS,2012.0,,Water-related violence in South Sudan refugee camp,Violence breaks out at water points in the Jamam refugee camp in South Sudan. Medicines Sans Frontieres reports that as many as 10 refugees die every day because of water shortages at refugee camps in South Sudan.,McNeish 2012,3.221
BO,2002.0,,Bolivian irrigators and townsmen clash over water rights,"Tarata, Bolivia experiences violent confrontations between irrigators from the region of Arbieto and residents of the nearby town of Tarata. The dispute centers on the allocation of water among these users and new water infrastructure that took water from the Laka Laka dam. In October, irrigators destroy approximately two kilometers of water supply pipeline. In response, residents destroy part of a primary irrigation channel. After failed negotiations, the water system is damaged again in December in another confrontation between irrigators and village residents.","Bustamante et al 2004, Moriarty Butterworth and van Koopen 2004",2.001
BO,2000.0,,"Riots over privatization in Cochabamba, Bolivia","Massive protests, riots, and violence result from efforts to privatize the water system of Cochabamba, Bolivia.",Shultz and Draper 2009,2.001
IQ,2014.0,2015.0,"Islamic State destroys water wells, pumps, and pipes in agricultural regions in Iraq","Farmers returning to their land in northwestern Iraq after the Islamic State (ISIS/ISIL) find widespread devastation to agricultural land, livestock, and machinery, including water pumps, wells, pipes and generators. One assessment by the Iraq Food and Security Cluster Partnership notes that of the 450 deep wells, only 50 are still useable. Another assessment by Amnesty International details the destruction of wells on the properties of more than 30 different farmers from across the country.",Joint Crisis Coordination Center 2015,3.006
IQ,2018.0,,Iraqi female activist assassinated,"An Iraqi activist, Su?ad Al-Ali, is assassinated while getting into her vehicle in Basra, Iraq. Mrs. Al-Ali had worked to bring better government services to her community, including safe and reliable drinking water.",Al Jazeera 2018a,3.006
IQ,2018.0,,"Tens of thousands admitted to hospitals from contaminated drinking water, inciting violence that leads to deaths and injuries","Tens of thousands fall ill from contaminated drinking water in Basra, Iraq. In response, citizen unrest escalates and protests turn violent, leaving at least 15 dead and hundreds injured.",Trew 2018,3.006
IQ,2017.0,,Islamic State militants burn water purification plant in Iraq,Militants from the Islamic State burn a water purification plant in a town north of the city of Mosul.,Raleigh et al 2010 ID. 350600,3.006
IQ,2017.0,,"A bomb planted at water, oil, and gas pipelines explodes","One of four bombs planted near water, gas, and oil pipelines explodes, injuring a policeman in Dibis, Kirkuk, Iraq.",Raleigh et al 2010 ID. 351470,3.006
IQ,2017.0,,Conflict over water quotas lead to two deaths in Iraq,"Conflict arises between two tribes over water quotas, leaing to two deaths and eight injuries in Suq Al-Shoyokh, Thi-Qar, Iraq.",Raleigh et al 2010 ID. 353965,3.006
IQ,2017.0,,Islamic State is accused of cutting off water to a village by diverting a river,"A group identified as the Islamic State is accused of cutting off the water flow to a village by diverting a river in Abu Karmah, Muqdadiyah, Diyala, Iraq.",Raleigh et al 2010 ID. 354937,3.006
IQ,2016.0,,"Islamic State fighters destroy pipeline that provides water for eastern Mosul, Iraq","Islamic State fighters cut electricity to pumping stations and destroy a pipeline that provides water for eastern Mosul, Iraq, leaving more than half a million people without water. The group has intentionally cut off water supplies to various neighborhoods, according to a Mosul City Council official responsible for supervising the city's water and energy services.","Tawfeeq and Abdelaziz 2016, Laessing 2016",3.006
IQ,2015.0,,Islamic State shuts off water flow below Ramadi Dam,"In June 2015, Islamic State in Iraq and the Levant (ISIL) militants shut off and redirect water flows below Ramadi Dam in order to facilitate military movements across the Euphrates River. As a result, communities downstream face water shortages.",Alkhshali and Smith-Spark 2015,3.006
IQ,2015.0,,Islamic State attacks Mosul Dam on the Tigris,"An attack by Islamic State (IS) fighters on the Mosul Dam on the Tigris river leads to the death of 16 Kurdish Peshmerga soldiers. The dam provides electricity to part of the Anbar province, which was under IS's control at the time. In August 2014, the dam is seized by Kurdish and Iraqi government forces from IS, who had taken control of it weeks earlier. The 1,200 families who are said to have been operating the dam mostly fled when IS seized power in fear that the dam would be used to flood downstream communities.",Al Jazeera 2015,3.006
IQ,2015.0,,Islamic State attacks Iraqi security forces around Euphrates River dam,"The Islamic State attacks Iraqi security forces and affiliated militiamen stationed around Adhaim dam on the Al Uzym River, north of Baghdad. Accounts differ as to the total number of deaths, however both sides suffer losses of life and numerous fighters are injured.",IANS 2015,3.006
IQ,2015.0,,Islamic State cuts off irrigation water,"Following the capture of Ramadi Dam, the Islamic State cuts water for irrigation systems and treatment plants in the predominantly Shiite downstream provinces of Babil, Karbala, Najaf and Qadisiya, threatening Iraqi food production.",UN Security Council 2017,3.006
IQ,2015.0,,Islamic State captures Tharthar Dam on the Tigris River,"The Islamic State attacks and successfully captures Tharthar Dam near Fallujah, on the Tigris River in Anbar province, Iraq. The attack leaves 127 Iraqi soldiers dead. After capturing the dam, the fighters open at least one floodgate, affecting downstream communities.",Sabah and Alwan 2015,3.006
IQ,2015.0,,Attack of a dam blocked in Iraq,In early January 2015 military troops in Iraq block an attack by IS militants that is attempting to destroy a dam and block a road connecting Diyala and the Shiite holy city of Sammara.,Xhinua_2015,3.006
IQ,2014.0,,Insurgents seize Falluja Dam,"Insurgents from Islamic State in Iraq and the Levant (ISIL) seize the Fallujah Dam in Iraq and close the floodgates to cause upstream flooding and to cut downstream water supply. The objective is to flood the area around the city of Fallujah to force government troops to retreat and lift a siege, while cutting water supplies and hydroelectricity generation for other parts of the country.",Coles 2014,3.006
IQ,1990.0,,Turkey's Ataturk Dam a weapon of war?,"The flow of the Euphrates is interrupted for a month as Turkey finishes construction of the Atat?rk Dam, part of the Grand Anatolia Project. Syria and Iraq protest that Turkey now has a weapon of war. In mid-1990 Turkish president Turgut ?zal  threatens to restrict water flow to Syria to force it to withdraw support for Kurdish rebels operating in southern Turkey.",Gleick 1993,3.006
IQ,2014.0,,Islamic State fighters advance on Haditha Dam,"Iraqi officials report that fighters with the Islamic State in Iraq and the Levant (ISIL) are advancing on the Haditha Dam, the second-largest in Iraq, raising the possibility of catastrophic damage and flooding. The ISIL militants are fighting for control of the Euphrates River dam, about 120 miles northwest of Baghdad and government forces were fighting to halt their advance. Army officers tell employees to stay inside and to be prepared to open the dam's floodgates if ordered to do so, one employee said.",Rubin and Nordland 2014,3.006
IQ,2014.0,,"Islamic State contaminates drinking water supplies, Syria","Islamic State deliberately contaminates drinking water with crude oil in the Balad district of the Salahaddin Governorate. Poisoned water supplies are also reported from Aleppo, Deir ez Zor, Raqqa, and  Baghdad.",UN Security Council 2017,3.006
IQ,2014.0,,Islamic State forces take control of Mosul Dam,"Mosul Dam in Iraq is taken over by Islamic State in Iraq and the Levant (ISIL) forces in August 2014. Over the next several weeks, Kurdish and US forces attack ISIS/ISIL in the region and retake control of the dam.",Maler 2014,3.006
IQ,2014.0,,U.S.-led coalition launches airstrikes to protect dams from ISIS,"A U.S.-led coalition launches a series of air strikes against targets of the Islamic State in Iraq and the Levant (ISIL) in areas around Mosul Dam, Fallujah Dam, and Haditha Dam in Iraq. U.S. aircraft destroy an ISIL-built earthen berm near the Fallujah Dam. This berm was built by ISIL to control downstream water supplies and to increase the flow of the Euphrates River into Abu Ghraib canals, flooding local Shiite neighborhoods in east Fallujah and forcing the locals to evacuate.",British Broadcasting Corporation (BBC) 2014b,3.006
IQ,2014.0,,Attack on water construction project in Iraq,"Shots are fired at a checkpoint for an Iranian company working on a water project south of Kirkuk, Iraq.",Aswat al-Iraq 2014a,3.006
IQ,2014.0,,Bombing injures two at water project in Iraq,Two people are injured when a bomb explodes near the center of the city Tuz Khurmatu at the town's water project.,Aswat al-Iraq 2014b,3.006
IQ,2014.0,,Islamic State uses Falluja Dam as a weapon,"Islamic State closes the Fallujah Dam floodgates and diverts water over an irrigation channel into a side valley, inundating land up to 100km away and placing parts of the city of Abu Ghraib under up to four meters of water. More than 10,000 houses and 200 square kilometers of farmland are flooded and extensive livestock killed. Water for millions of people in the cities of Karbala, Najaf, and Babil is cut off for a time.",UN Security Council 2017,3.006
IQ,2014.0,,Multiple water projects are attacked in Iraq,"In less than a week, several water projects are the targets of explosives, killing six employees of one of the water projects and damaging the infrastructure in Al-Shirqat District, Saladin Governorate, and Mushirfah, Nineveh Governorate, Iraq.","National Consortium for the Study of Terrorism and Responses to Terrorism (START) 2018 ID. 201404090018, 201404130034",3.006
IQ,2014.0,,Islamic State blocks access to water,"In Iraq, Islamic State blocks access to water in the predominantly Christian town of Qaraqosh (also known as Bakhdida), take over farms and agricultural land, and expel most of the 50,000 residents.",UN Security Council 2017,3.006
IQ,2014.0,,Water purification plant in Fallujah attacked,"At least two people die from a blast at a water purification plant in the city of Fallujah, in Al Anbar Province. More than 20 people are hospitalized from chlorine poisoning from the destruction of a water-purification chemical storage facility.",National Consortium for the Study of Terrorism and Responses to Terrorism (START) 2018 ID. 201406130089,3.006
IQ,2014.0,,Haditha Dam on the Euphrates River is attacked,Reports from a military spokesperson from Iraq say secuirty forces fought off militant groups trying to sieze Haditha and a nearby dam on the Euphrates River. 40 militants are killed by the security forces.,Derechos Human Rights and Equipo Nizkor 2014,3.006
IQ,2014.0,,"At least 30 people reported killed in attack on Hadithah Dam, Iraq",At least 30 people are reported killed during an attack on a dam in the Hadithah area of Iraq. No group claims responsibility for the attack but it is thought to have been carried out by Islamic State.,National Consortium for the Study of Terrorism and Responses to Terrorism (START) 2018 ID. 201412290031,3.006
IQ,2013.0,,Water project employees kidnapped in Iraq,Four water project employees are kidnapped by assailants dressed as police officers. The outcome of the kidnapping is unknown and no group has claimed responsibility for the incident.,National Consortium for the Study of Terrorism and Responses to Terrorism (START) 2018 ID. 201311190066,3.006
IQ,2012.0,,"Assailants fire a mortar round, striking a water facility","Assailants fire a mortar round, striking a water facility in Mosul city, Nineveh governorate, Iraq. One security guard is killed in the attack, and the facility is damaged. This is one of 32 coordinated incidents across Iraq on the same day. Al-Qa'ida in Iraq claims responsibility for the attacks, stating that they are in retaliation for the torture and genocide that Sunni civilians face in Iraqi prisons.",National Consortium for the Study of Terrorism and Responses to Terrorism (START) 2018. ID. 201202230016,3.006
IQ,2010.0,,Unidentified militants detonate an improvised explosive device targeting a water tanker,"On Thursday, in the town of al-Qaim in Iraq's Anbar province, a driver and two civilians are wounded and a water tanker truck is damaged when unidentified militants detonate an improvised explosive device targeting a water tanker. No group claims responsibility for the attack.",National Consortium for the Study of Terrorism and Responses to Terrorism (START) 2018. ID. 201005060012,3.006
IQ,2010.0,,An improvised explosive device detonates at a potable water plant,"In the Abu Ghurayb neighborhood of Baghdad city, Baghdad province Iraq, two government employees are killed and another is wounded when an improvised explosive device detonates at a potable water plant. The amount of damage from the attack is unknown. No group claims responsibility for the attack.",National Consortium for the Study of Terrorism and Responses to Terrorism (START) 2018. ID. 201012020006,3.006
IQ,2009.0,,An improvised explosive device attached to a water tanker explodes,"An improvised explosive device attached to a water tanker in the al-Mahawii district of the Babel province explodes, wounding the driver. The blast causes severe damage to the tanker. No one claims responsibility for the attack.",National Consortium for the Study of Terrorism and Responses to Terrorism (START) 2018. ID. 200912110015,3.006
IQ,2008.0,,Iraqi water station destroyed,"A water station under construction is destroyed in an attack by an unidentified gunman. Explosives are also placed on the road near the project, injuring one person. The station was going to provide potable water to four villages that were at a distance from the Tigris River, east of Dalouiya.",Berwani 2008,3.006
IQ,2008.0,,Militants blow up a section of a water pipeline,"Militants blow up a section of a water pipeline in Baghdad, Iraq. The explosion tears an 18-inch hole in the pipe that carries drinking water to Baghdad's Adhamiyah, Rusafa, and Karrada districts. No casualties are reported and no group claims responsibility for the attack.",National Consortium for the Study of Terrorism and Responses to Terrorism (START) 2018. ID. 200810300021,3.006
IQ,2007.0,,Workers fixing a water pipe killed,"Two workers fixing a water pipe in Baghdad, Iraq, are killed in an event that is reported as either a drive-by shooting or a bomb explosion. The pipeline was being fixed from an attack a month earlier.",RAND Database of Worldwide Terrorism Incidents 2018,3.006
IQ,2007.0,,Mortar fired at water treatment plant,"A mortar is fired at a water treatment plant in Baghdad, Iraq. No casualties are reported.",RAND Database of Worldwide Terrorism Incidents 2018,3.006
IQ,2007.0,,Director-general of water projects killed by gunmen,"The director-general of water projects in Badush, Iraq is shot and killed by gunmen.",RAND Database of Worldwide Terrorism Incidents 2018,3.006
IQ,2007.0,,Workers constructing water pipe attacked; two killed,"A bomb placed along a road kills two workers and wounds five others as they lay water pipes in Tal Afar, Iraq.",RAND Database of Worldwide Terrorism Incidents 2018,3.006
IQ,2007.0,,Bloody fight at a water filtering station leaves at least 33 dead,"An attack on a water-filtering station in the Al-Khalis District of Diyala Governorate in Iraq is thwarted by the Iraqi military and other forces, leaving at least 33 of the attackers dead. The number of deaths on the Iraqi side is not reported.",RAND Database of Worldwide Terrorism Incidents 2018,3.006
IQ,2007.0,,Tigris River polluted after bomb strikes oil pipeline,"The Tigris River is polluted with oil after a bomb strikes a pipeline near Baiji, Iraq. The river supplies drinking water for nearby communities.",RAND Database of Worldwide Terrorism Incidents 2018,3.006
IQ,2006.0,,Unsuccessful targeting of water pipeline,"A water pipeline in Baghdad is targeted by an explosive device placed nearby. However, the explosion does not damage the pipeline.",RAND Database of Worldwide Terrorism Incidents 2018,3.006
IQ,2006.0,,Employee of Iraq's Ministry of Water Resources killed,An employee of the Ministry of Water Resources in Iraq is killed by a gunman.,RAND Database of Worldwide Terrorism Incidents 2018,3.006
IQ,2006.0,,"Explosive device aimed for water supply detonates early, killing two, wounding one","An explosive device targeting a water main in Kirkuk, Iraq, detonates prematurely, killing two and injuring one of the attackers.",RAND Database of Worldwide Terrorism Incidents 2018,3.006
IQ,2006.0,,Two water truck drivers killed,"The drivers of a water truck are killed in Baghdad, Iraq by a gunman while driving for work.",RAND Database of Worldwide Terrorism Incidents 2018,3.006
IQ,2006.0,,Director of water project killed,"The director of the Baqubah water project, Husayn Ali Atiyah, is killed by gunmen. The attack is considered part of a larger effort to undermine the Iraqi reconstruction process.",RAND Database of Worldwide Terrorism Incidents 2018,3.006
IQ,2006.0,,Government official killed,"A government official working with the water authority in Kirkuk, Iraq is killed.",RAND Database of Worldwide Terrorism Incidents 2018,3.006
IQ,2006.0,,Gunmen blow up the pipes of a drinking water treatment plant running to the U.S. Ayn al-Asad base,"Gunmen blow up the pipes of a drinking water treatment plant running to the U.S. Ayn al-Asad base. Clashes rage between the gunmen and members of the plant's security, and are followed by explosions that lead to the destruction of the plant's water pumps and power generators. No group claims responsibility for the attack.",National Consortium for the Study of Terrorism and Responses to Terrorism (START) 2018. ID. 200604100025,3.006
IQ,2005.0,,Water pipeline attacked with bomb,"A bomb placed near a water pipeline explodes, causing it to break. That same day, two nearby oil pipelines are also attacked.",RAND Database of Worldwide Terrorism Incidents 2018,3.006
